word,definition,weight
indication,"/ndken/  n. 1 [C] a sign, signal: The arrows in the elevator give an indication of whether it is going up or down. 2 [C;U] meaning, hint: An increase in rain gives us an indication that grass will be greener soon. -n. [C] indicator /ndketr/; -adj. indicative /ndktv/.",9
indigenous,"/nddns/  adj. born in, native to: The Navajo tribes are indigenous to Arizona.",9
indiscreet,"/ndskrit/  adj. not showing wise or good behavior, esp. in telling the secrets of others, (syn.) untrustworthy: Don't tell private things to an indiscreet person, or everyone will know about them.",9
indisposed,"/ndspozd/  adj.frml. 1 not able to do s.t., usu. because of sickness: The opera star has a cold and is indisposed today. 2 not interested: Those rich people are indisposed toward helping their poor neighbors.",9
indistinct,"/ndstkt/  adj. not easy to be seen or heard, (syns.) blurred, fuzzy: His voice was indistinct because of the loud music. -adj. indistinctive.",9
individual,"/ndvdul/  n. one person: Three individuals walked away from the crowd.  adj. different from others, single, separate,: When Frida speaks, she has an individual accent, because as a child she lived for five years in Mexico, five years in the USA, and five years in Korea.Thesaurus: individual n. a human being, mortal | creature, entity. adj. distinct, particular, singular.",9
inducement,"/ndusmnt/  n. [C;U] s.t. that makes s.o. want to do s.t., (syns.) motive, incentive: The company promised her a big office as an inducement to take the job.",9
indulgence,"/ndldns/  n. 1 [U] patience, tolerance: I ask your indulgence while I tell you this long, boring story. 2 [C] s.t. one enjoys, even though it may be bad or wrong: Two glasses of wine at dinner is my only  indulgence.",9
industrial,"/ndstril/  adj. related to industry (esp. manufacturing): Industrial production is up this year, but agriculture is weak.",9
inebriated,/nibrietd/  adj.infrml. drunk: He drank too much beer and is inebriated. -n. [U] inebriation /nibrietn/.,9
ineligible,"/nldbl/  adj. not able to  do s.t. for some reason (too young, not  skilled, etc.), (syn.) unqualified: He is ineligible to enter college, because he has  not finished high school. -n. [U]  ineligibility.",9
inequality,"/nikwlti/  n. [C;U] -ties 1 a condition in which s.t. is greater or less than s.t. else: There is an issue of inequality here; I make $20,000 a year and you make $30,000, but we do the same job. 2 a different amount of opportunity or resources from s.t. else: Inequality among nations can cause war.Thesaurus: inequality 1 a disparity, unevenness, irregularity 2 a disparity, imbalance. Ant. equality.",9
inevitable,"/nvtbl/  adj. definitely going to happen, unavoidable, certain: Gaining weight is inevitable when you eat too much and don't exercise.",9
inexplicit,"/nksplst/  adj. not clear, inexact, (syn.) vague: His directions are inexplicit; we'll get lost.",9
infallible,"/nflbl/  adj. never making a mistake, faultless: Calculations from that computer are infallible.",9
infarction,"/nfrkn/  n. (in medicine) clotting and blockage of a blood vessel, esp. in the heart, a heart attack: That patient died of an infarction before she could have heart surgery.",9
infatuated,"/nftuetd/  adj. in love in a brief, often unthinking way: He was infatuated with (or) by a model one week, an artist the next. -v. [T] infatuate; -n.[C;U] infatuation. ",9
infidelity,/nfdlti/  n. [C;U] -ties having sex with s.o. besides a husband or wife: She divorced her husband for infidelity after she found him in bed with another woman.,9
infiltrate,"/nfltret/  v. [I;T] -trated, -trating, -trates to join or enter s.t. for a secret purpose: The police infiltrated the drug dealer's house by pretending to want some cocaine. -n. [U] infiltration.",9
infinitive,"/nfntv/  n. (in grammar) the main form of a verb, usu. used with ""to"": ""To go"" is the infinitive form of the verb ""go.""",9
inflection,/nflkn/  n. [C;U] a change in the voice's sound or tone: The inflection in her voice goes up when she asks a question.,9
inflexible,"/nflksbl/  adj. 1 rigid, unbending: The metal bars of a jail are inflexible. 2 with strong, unchanging opinions, stubborn, (syn.) unyielding: He is very inflexible in his habits, reading the same newspaper every morning. -n. [U] inflexibility.",9
infraction,/nfrkn/  n. the breaking of a rule or law: He parked his car in a no-parking zone and had to pay a fine for the infraction.,9
infrequent,"/nfrikwnt/  adj. seldom, not often: His visits to his parents are infrequent because he lives far away.",9
ingratiate,"/ngreiet/  v. [T] -ated, -ating, -ates to get respect by doing nice things (usu. expecting s.t. back): He ingratiates himself with important people by inviting them to his parties.",9
ingredient,"/ngridint/  n. 1 a food item in a recipe: Flour, milk, butter, and yeast are some ingredients in bread. 2 a part of s.t.: Hard work is an ingredient of success.Thesaurus: ingredient 1 a component 2 a component, factor, element.",9
inhabitant,/nhbtnt/  n. a person who lives in a certain area: The inhabitants of San Francisco enjoy a view of the Golden Gate Bridge.,9
inhibition,"/nhbn, n/  n. s.t. that makes a certain behavior difficult, usu. psychologically: He has so many inhibitions about his body that he went on a strict diet.",9
initiative,"/ntv/  n. [C;U] the first step, usu. showing strength, (syn.) ambition: He showed initiative by learning Spanish before moving to Colombia.",9
injunction,"/ndkn/  n. (in law) a stop, an ending: A court issued an injunction to stop the man from harassing his former wife.",9
inner city,"  n. a city's central area, esp. a poor area or slum: Mayor Perez is trying to help the inner city with neighborhood police and better playgrounds.",9
innovation,"/nven/  n. [C;U] s.t. new made or improved with creativity: Cellular telephones were an innovation in the 1990s, but now they are very common. -adj. innovative /nvetv/.",9
inoperable,"/nprbl, pr/  adj. not able to be cured with surgery, fatal: He has inoperable cancer.",9
inordinate,"/nrdnt/  adj. great, large, more than necessary: He takes an inordinate amount of time in the morning, so we're always late to school.",9
insatiable,"/nsebl/  adj. not able to get enough of s.t., not satisfied with a normal amount: His insatiable hunger made him eat three hamburgers and want more.",9
inseminate,"/nsmnet/  v. [T] -nated, -nating, -nates to make pregnant by putting male semen into a female body: My aunt was inseminated with her husband's sperm. -n. [C;U] insemination.",9
in-service,"  n.adj. a short educational course about one's job, taught during the day at work: The nurses went to an <adj.> in-service class about AIDS.",9
insistence,/nsstns/  n. [U] strong pressure to do s.t.: Her insistence on quality keeps her employees hard at work. -adj. insistent.,9
insofar as,"/nsofrz, z/  conj. as much or as long as (possible): Insofar as my grandfather is able to walk, he won't use a  wheelchair.",9
inspection,"/nspkn/  n. [C;U] 1 a close, careful look, examination, (syn.) scrutiny: Inspection of the new house shows that it needs a new roof. 2 to pass inspection: to receive approval: Soldiers must pass inspection to make sure their uniforms are clean.",9
instructor,"/nstrktr/  n. 1 a teacher: My swimming instructor showed us how to dive into the water. 2 the lowest level of college teacher: When she completes her Ph.D., her title will change from instructor to assistant professor. See: teacher, USAGE NOTE.",9
instrument,"/nstrmnt/  n. 1 a tool that helps s.o. do work: The doctor used an instrument to look in the girl's ears. 2 an object for making music, such as a violin, piano, or horn: She plays two musical instruments and is now learning to sing.Thesaurus: instrument 1 a device, implement, piece of equipment. ",9
insulation,"/nslen/  n. [U] any material that keeps out cold, heat, and/or sound: My winter jacket has goose feathers as insulation.",9
insurgency,"/nsrdnsi/  n. [C;U] the state of being or acting against a government or political power, (syns.) a rebellion, revolt: Radical party members started an insurgency against their leaders. -n. [C;U] insurgence; -adj. insurgent.",9
intangible,"/ntndbl/  adj. not able to be felt with touch, sight, or hearing, but still sensed: My grandmother, who died last year, is an intangible presence in my life.",9
interested,"/ntrstd, trs, trs/  adj. having curiosity, wanting to know more: He is interested in travel, so he visits a different country every year.Thesaurus: interested engaged by s.t., absorbed by s.t., drawn in by s.t. Ant. uninterested.Usage Note: If s.o. or s.t. excites your interest, you are interested: I'm interested in reading more of her books. The person or thing itself is interesting: Her ideas are interesting.||She's an interesting writer.",9
interloper,"/ntrlopr/  n. a person who goes where he or she has no right to go or doesn't belong, (syn.) an intruder: Who are these interlopers? They weren't invited!",9
intermarry,"/ntrmri/  v. [I] -ried, -rying, -ries to marry s.o. of a different race, religion, etc.: A Jewish man and a Catholic woman intermarried against their parents' wishes. -n. [U] intermarriage /ntrmrd/.",9
interstate,"/ntrstet/  adj. in the USA, of or between states: You can travel on Interstate Highway 20 from Atlanta, Georgia, to Columbia, South Carolina.  n. a numbered superhighway: We drove off a small country road onto the interstate.Thesaurus: interstate n. a highway, thruway, turnpike.",9
intertwine,"/ntrtwan/  v. [I;T] -twined, -twining, -twines to wind around each other, (syn.) to twist: The tree's branches intertwined as they grew. -n. [U] intertwining.",9
interweave,"/ntrwiv/  v. [I;T] -wove /wov/, -woven /wovn/, -weaving, -weaves to blend together, (syn.) to entwine: The author interweaves historical events into her novels.",9
intimidate,"/ntmdet/  v. [T] -dated, -dating, -dates to make s.o. fearful or timid by showing power or making threats: An older boy intimidated the little children when he took their lunch money. -n. intimidation.",9
intonation,"/ntnen, to/  n. [U] 1 the level of the voice (high or low): Even though they both speak English, their intonation is different, because Mary comes from London and Gina comes from New York. 2 the ability to sing the right note: Your intonation is terrible; you're hurting my ears! -v. [I;T] intone.",9
intoxicate,"/ntksket/  v. [T] -cated, -cating, -cates 1 to make drunk, (syn.) to inebriate: Drinking beer and whiskey intoxicates him. 2 to excite greatly: The queen was intoxicated with her own power. -n. [U]  intoxication.",9
intramural,"/ntrmyrl/  adj. within an organization, esp. a school or college: The freshmen played intramural football against the sophomores.",9
intriguing,"/ntrig/  adj. interesting, causing curiosity, (syn.) fascinating: Psychologists find human emotions intriguing.",9
invalidate,"/nvldet/  v. [T] -dated, -dating, -dates 1 to make illegal or unusable: Airport workers invalidated the drug dealer's passport so he could not leave the country. 2 to show to be wrong: People who saw you steal the money invalidated your story about being home at the time. -n. [U] invalidation.",9
invaluable,"/nvlyubl/  adj. extremely valuable, worth a great deal: Your help in moving the big refrigerator was invaluable.",9
invariably,"/nvribli/  adv. without exception or change: Invariably, her advice is excellent; we always do what she says. -adj. invariable.",9
investment,"/nvstmnt/  n. 1 [C;U] money spent on s.t. in the hope of making more money: His investments in the stock market have made him a millionaire. 2 [C;U] s.t. one pays for with the future in mind: The diamond was a good investment; it is worth more now than when I bought it. 3 [U] money, time, energy, etc. toward s.t.: Her investment of hard work and love has made her children good, honest people.",9
inveterate,"/nvtrt/  adj.frml. longtime, habitual: He is an inveterate sailor who spends all his time on his boat.",9
invigorate,"/nvgret/  v. [T] -ated, -ating, -ates to give s.o. energy, (syn.) to stimulate: Cold weather invigorates my brother and makes him work harder. -n. [U] invigoration.",9
invincible,"/nvnsbl/  adj. too strong (smart, etc.) to be beaten: The invincible soccer team won every game. -n. [U] invincibility.",9
invitation,/nvten/  n. a card or spoken request asking s.o. to come to an event: The couple sent out wedding invitations to family and friends.,9
invocation,/nvken/  n. an opening prayer: A minister gave the invocation at the university graduation ceremony.,9
iridescent,"/rdsnt/  adj. showing colors of the rainbow, usu. shiny: She wore an iridescent dress that seemed to change color in the lamplight.",9
irrational,"/rnl/  adj. 1 done without thinking, (syn.) illogical: I had the irrational wish to laugh loudly in church. 2 crazy, insane: Your fears are irrational; no one is  going to hurt you. -n. [U] irrationality /rnlti/.",9
irrelevant,"/rlvnt/  adj. not important to the situation, (syn.) extraneous: It is irrelevant to me whether you are rich or poor, as long as you are kind. -n. [U] irrelevance.",9
irreverent,"/rvrnt/  adj. not showing respect, esp. for religious beliefs: The rabbi thought his daughter was irreverent when she didn't go to temple on Yom Kippur. -n. [U]  irreverence.",9
Ivy League,"  n. in the USA, eight northeastern universities known for strong  academics, competing sports teams, tradition, and wealth; they are Brown, Columbia, Cornell, Dartmouth, Harvard, Princeton, the University of Pennsylvania, and Yale: My  father played football in the Ivy League when he was at Yale.  adj. having to do with the Ivy League,  usu. meaning a fine education, traditional  behavior, and wealth: He acts like an Ivy League snob, but he never graduated from high school.",9
Jack Frost,/dkfrst/  n. an imaginary man associated with frost and cold weather: It is so cold outside that Jack Frost is biting my nose; it's all red.,9
jackhammer,"/dkhmr/  n. a powerful, handheld tool used to break up rocks and cement: The sound of a jackhammer is very loud.",9
jeopardize,"/dprdaz/  v. [T] -ized, -izing, -izes to make it easy for s.t. bad to happen, to put in danger, (syn.) to endanger: She jeopardized her job by always being late.",9
jerrybuilt,/driblt/  adj. cheaply and poorly built: That jerrybuilt house is falling apart.,9
jet engine,  n. an engine that moves an airplane by shooting streams of hot gas backwards: Jet engines are powerful enough to carry huge planes.,9
jet stream,"  n. a high-speed wind very high in the sky: Our plane had the jet stream pushing it, so we arrived an hour early.",9
job action,"  n. a workers' protest, such as stopping work for a short time: The union started a job action to force management to pay the workers more.",9
journalese,"/drnliz, is/  n. [U] special words and phrases used often by journalists: ""Have the politicians begun to address the issues?"" is journalese for ""Are politicians doing s.t. about the country's problems?""",9
journalism,/drnlzm/  n. [U] 1 the gathering and reporting of news 2 the study of that field: She is studying journalism so that she can write for a newspaper.,9
journalist,"/drnlst/  n. a person whose job is to gather and report the news: Journalists write news stories for magazines and newspapers. -adj. journalistic.Thesaurus: journalist a reporter, columnist, correspondent.",9
journeyman,"/drnimn/  n. -men a worker whose work is acceptable but not the best: He is a good journeyman, but his partner's work is better.",9
jubilation,"/dubletn/  n. [U] a joyful celebration: When the war ended, there was jubilation all over the country.",9
judgmental,"/ddmntl/  adj. quick to make decisions about s.o. or s.t., usu. negative: Don't be so judgmental; today is his first day on the job.",9
juggernaut,"/dgrnt/  n. a great, unstoppable force: That army is a juggernaut that crushes its enemies.",9
kettledrum,/ktldrm/  n. a large bowl-shaped copper or brass drum tightly covered with a thin material (parchment): The kettledrum sounds like thunder when you hit it hard.,9
kindliness,"/kandlins/  n. [U] kindness and concern for others, (syn.) compassion: His kindliness toward animals is well-known.",9
kingfisher,/kfr/  n. a type of colorful bird: Kingfishers dive into the water to catch fish.,9
knockwurst,"/nkwrst/  n. [U] spicy, finely chopped meat stuffed into a casing and sold in sections linked together like a sausage: Many people like to eat knockwurst with sauerkraut.",9
labor camp,"  n. a type of prison where prisoners (inmates) work: During the war, prisoners were sent to work in labor camps.",9
laboratory,/lbrtri/  n. -ries a specially equipped room for doing experiments and other exploratory work: Scientists develop new products in the laboratory.,9
laceration,"/lsren/  n. a cut, (syn.) a slash: He received lacerations on his face in the accident. -v. [T] lacerate.",9
lackluster,"/lklstr/  adj. ordinary, dull: The performance of the symphony was not good, it was lackluster.",9
lamentable,"/lmntbl/  adj.frml. involving sadness, regret, or sorrow: His accidental death was most lamentable.",9
landholder,/lndholdr/  n. a person who owns property: Any landholder in the center of town must be rich.,9
landlocked,/lndlkt/  adj. surrounded on all sides by land: A landlocked country like Switzerland has no seaports.,9
landlubber,/lndlbr/  n. a person not used to boats or the sea: Don't ask me about sailing; I'm a complete landlubber!,9
laryngitis,/lrndats/  n. [U] a painful condition caused by inflammation of the larynx in the throat and affecting speech: The speaker had laryngitis and canceled his talk.,9
lascivious,"/lsvis/  adj.frml. related to strong sexual desire, lustful: His lascivious  desires lead to disgusting behavior.",9
last straw,"  n.fig. the final displeasing event in a series of events that causes s.o. to take action: He is always late, and when he was late for a very important meeting, that was the last straw; he was asked to leave the company.",9
last-ditch,  adj. done or made as a frantic final attempt: Negotiators made a last-ditch effort to reach an agreement before the fighting began again.,9
launch pad,  n. an area with a hard surface and supporting equipment from which spacecraft are launched: The missile roared off the launch pad into the sky.,9
lawbreaker,/lbrekr/  n. a person who  disobeys a law: The police want to catch  lawbreakers.,9
lawn mower,  n. a machine used to cut grass: He uses a riding lawn mower to cut his large yard.,9
left field,"  n. 1 (in baseball) the left part of the outfield: He caught the ball in left field. 2 infrml. way out in left field: wrong, impractical, far from the truth or reality: His ideas on how to do things are way out in left field.",9
legislator,"/ldsletr/  n. a person elected to propose and vote on new laws: In the US Congress, the legislators are Senators and Representatives.",9
legitimate,"/ldtmt/  adj. 1 legal, lawful: He has a legitimate claim to part of the profits. 2 honest, genuine: She runs a legitimate business. 3 reasonable, justified: She has a legitimate concern about her daughter's health. 4 born to parents legally married to each other -n. legitimacy.",9
legitimize,"/ldtmaz/  v. [T] -mized, -mizing, -mizes to make legitimate: By getting married, the couple legitimized their young child. -v. [T] legitimate /ldtmet/.",9
lengthwise,"/lkwaz, ln/  adv. in the direction of the length of s.t.: We measured the table lengthwise at six feet and across at three.",9
leprechaun,"/lprkn/  n. in stories about Ireland, a little elf-like man: It is said that leprechauns have hidden pots of gold.",9
letterhead,"/ltrhd/  n. sheets of writing paper with a person's or business's name, address, and telephone number printed at the top: I write letters to customers on the company  letterhead.",9
liberalism,"/lbrlzm, lbr/  n. a set of beliefs favoring change in politics, religion, etc.: His liberalism led him to join a community action group.",9
liberalize,"/lbrlaz, lbr/  v. [T] -ized, -izing, -izes to make more liberal and less strict, such as to extend government programs to benefit more people: The tax laws have been liberalized to make it easier to save money for retirement.",9
liberation,/lbren/  n. an act of freedom from oppression: The peace agreement called for the liberation of all prisoners of war.,9
lieutenant,/lutnnt/  n. 1 (in the USA) an officer of the lowest military rank 2 (in many civil positions) a rank below: He was elected Lieutenant Governor of Louisiana.,9
light bulb,  n. 1 the round glass part of an electric light: The light bulb in the lamp is burned out. 2 infrml. to have a light bulb go on: a sudden understanding: A light bulb went  on when she found the solution to the math problem.,9
lighthouse,/lathas/  n. a tall building housing a light to guide ships,9
lights-out,  n. a time when lights are turned off: Eleven o'clock is lights-out in that prison.,9
light-year,"  n. 1 the distance that light travels in a year, or approx. 5.88 trillion miles (9.46 trillion km): Astronomers measure the distance to stars in light-years. 2 fig. (indicating superiority) a great distance: That company's product is light-years ahead of the competition in quality.",9
like terms,"  n. in math, terms that can be algebraically summed because they contain the same variables with the same exponents: The sum of like terms 4x2y   3x2y is 7x2y. ",9
likelihood,"/laklihd/  n. probability (of s.t. happening): In all likelihood, it will rain today.",9
limitation,/lmten/  n. 1 [C;U] a restriction in amount or extent: The limitation on spending for new equipment is now set. 2 [C] restrictions in one's ability: That employee has limitations on what work he can do.,9
list price,  n. the regular retail price of an item: No one likes to pay the list price for an item; everyone wants a discount.,9
literature,"/ltrtr/  n. [U] 1 written works, such as novels, poems, and plays, and commentary about them: She is a professor of French literature. 2 written information about a specific field: The current literature on medicine is highly technical.",9
litigation,/ltgen/  n. 1 [C] a lawsuit: We began a litigation against that firm. 2 [U] the process of litigating: The litigation came  to an end after many years. -adj. litigious /ltds/.,9
little toe,  n. the outer toe on the foot: She has a blister on her little toe from walking.,9
livability,/lvblti/  n. the degree of comfort and convenience of a place: That small city is known for its livability.,9
livelihood,/lavlihd/  n. way of earning money to live: He makes his livelihood as a carpenter.,9
liverwurst,/lvrwrst/  n. ground liver in roll form: Liverwurst is used in sandwiches.,9
loan shark,"  n. a person or business that lends money at extremely high interest rates, esp. money provided by organized crime: Loan sharks operate outside the law. -n. [U] loan sharking. ",9
locomotive,/lokmotv/  n.adj. a large railroad vehicle with an engine: Several <n.> locomotives can pull a string of freight cars a mile long. -n. [U] locomotion.,9
loggerhead,"/lgrhd, la/  n.fig. at loggerheads: arguing, in disagreement: The two partners are always at loggerheads with each other and may split up.",9
logrolling,"/lgrol, lg/  n. [U] 1 transport of logs by water: Lumbermen use logrolling down a river to move logs to a port. 2 a sport between two opponents, each one trying to roll the other off a log placed in water",9
loneliness,"/lonlins/  n. [U] a condition of being alone and feeling sad: Most people experience loneliness sometimes.Thesaurus: loneliness solitude, isolation (from others), seclusion.",9
long johns,/dnz/  n.pl. underwear covering the entire body from neck to wrists and ankles: People wear long johns during cold winters.,9
long-lived,"/llavd, lvd/  adj. living a long time: His parents were long-lived; they died when they were well into their nineties.",9
long-range,  adj. 1 covering a time period lasting far into the future: The company must make long-range plans. 2 operating over long distances: long-range missiles,9
look-alike,"  n. a person who closely resembles another, a double: She is a look-alike for a famous movie star.",9
loose-leaf,  adj. containing individual sheets of paper that can usu. be removed or replaced: Students keep notes in a loose-leaf binder.,9
love child,  n.old usage a child born to a couple not married to each other: The king kept his love child a secret from the public.,9
lugubrious,"/lgubris/  adj.frml. sad, (syns.) sorrowful, mournful: The losing players sat with lugubrious faces while the winners celebrated.",9
lumberjack,/lmbrdk/  n. a person who cuts down trees or transports them: His father was a Canadian lumberjack.,9
lumberyard,/lmbryrd/  n. a business that sells lumber: I bought shingles at the lumberyard to repair my roof.,9
magistrate,"/mdstret, strt/  n. a low-level government official with power to enforce the law: The traffic magistrate heard the man's explanation for getting a parking ticket.",9
mail order,  n. the system of selling products by mail: She shops for clothes by mail order.,9
mainstream,"/menstrim/  n. the group of ideas accepted by the majority of people, the most popular way of thinking: Her ideas are in the mainstream of American political thought.  adj. accepted by most people, (syn.) conventional: The politician has a <adj.> mainstream political view (or) her ideas are in the <n.> mainstream.  v. [T] to mix a person into a main group: Some non-native students take bilingual classes and are mainstreamed into regular classes later.",9
