word,definition,weight
discourage,"/dskrd, skr/  v. [T] -aged, -aging, -ages 1 to take away one's confidence or hope: Poor grades on her exams discouraged her. 2 to advise against, try to prevent:  I discouraged him from staying in college  any longer. -n. discouragement; -adj. discouraging.Thesaurus: discourage 1 to dishearten, demoralize, depress. 2 to urge against, dissuade. Ant. toencourage.",9
discretion,"/dskrn/  n. [U] 1 the quality of being discreet, (syns.) prudence, caution: Lawyers and doctors must act with discretion and not speak to others about their clients. 2 at (s.o.'s) discretion: as (s.o.) chooses or decides: Use the money at your own discretion.",9
discursive,/dskrsv/  adj. (of a person or s.t. written) passing with many words from one subject to another: Her writing is discursive but thorough. -adv. discursively.,9
discussion,"/dskn/  n. 1 [C;U] a talk, serious conversation: We had a discussion about solving the problem. 2 a formal conference: They are holding a discussion in Geneva about international banking. 3 under discussion: being talked about: A new contract is now under discussion.",9
disdainful,"/dsdenfl/  adj. showing no respect, (syn.) contemptuous: The oldest students sometimes have a disdainful attitude toward the newly arrived students. -adv. disdainfully.",9
disembowel,/dsmbal/  v. [T] to cut the bowels out: The hunter disemboweled the deer that he had killed.,9
disgusting,"/dsgst/  adj. 1 causing strong dislike and impatience, (syn.) offensive: The politicians can't solve anything; it's disgusting! 2 sickening, (syn.) nauseating: That garbage in the streets is disgusting.",9
disharmony,"/dshrmni/  n. [C;U] -nies lack of agreement, (syns.) discord, friction: There is constant disharmony among members of that family; they're always arguing.",9
dishearten,"/dshrtn/  v. [T] to take away the will to continue, discourage: A lack of cooperation disheartened him in his effort to find a solution to the problem.",9
disheveled,"/dvld/  adj. to have one's appearance (hair, clothes, etc.) in disorder: After falling down, he was all disheveled.",9
dishonesty,"/dsnsti/  n. [U] the failure or refusal to be honest or truthful, (syn.) deceit: The liar is guilty of dishonesty in what he says and does.",9
dishwasher,"/dwr, w/  n. 1 a machine used to wash dishes: Our dishwasher uses a lot of water. 2 a person whose job is washing dishes: He's a dishwasher in a Chinese restaurant.",9
disinherit,"/dsnhrt/  v. [T] to take away rights of inheritance, remove (s.o.) from one's will so that person gets nothing when one dies: The old man disinherited his son after years of disagreements and arguments.",9
disjointed,"/dsdntd/  adj.fig. not well connected, awkward: Feeling confused and embarrassed, he made a disjointed speech (argument, presentation). -adv. disjointedly.",9
disk drive,  n. the place (in a computer or compact disc player) where the disk is inserted,9
disloyalty,"/dsllti/  n. [U] unfaithfulness, lack of loyalty: Her disloyalty to her friend ended their friendship.",9
disordered,"/dsrdrd/  adj. 1 lacking order, messy: We couldn't understand her disordered presentation. 2 physically or mentally ill",9
disorderly,"/dsrdrli/  adj. 1 using violence in public, (syn.) rowdy: The protesters became disorderly and were arrested. 2 disorganized, messy: His disorderly manner of leading a meeting causes confusion.",9
dispassion,"/dspn/  n. [U] neutrality, disinterest without emotion: A judge must consider matters objectively, with dispassion.",9
dispatcher,"/dsptr/  n. a person who sends and keeps track of people, vehicles, messages, etc.: She works as a taxi dispatcher, using a radio to tell the taxis where to go.",9
dispensary,/dspnsri/  n. -ries a place from which medical supplies are given out:  I went to the hospital dispensary for some  bandages.,9
dispersion,"/dsprn,n/  n. 1 [U] flow or movement, esp. in a scientific sense: The experiment showed the dispersion of particles in a liquid. 2 [C;U] a breaking up, scattering in different directions: the dispersion of light into its spectrum of colors 3 [U] a spread over an area: He studied the dispersion of plants throughout that region.",9
dispirited,"/dsprtd/  adj.frml. discouraged, disheartened: She feels dispirited by the loss of her job.",9
disposable,/dspozbl/  adj. 1 capable of being thrown away after use: Paper napkins are disposable. 2 disposable income: money one is free to spend after taxes are taken out,9
dispossess,/dspzs/  v.frml. [T] -es to force out of a home or land by legal action or by wrongful act: The court dispossessed the family from their house for not paying their taxes.,9
disputable,"/dspyutbl/  adj. questionable, doubtful: What he says is disputable; I don't believe it.",9
disqualify,"/dskwlfa/  v. [T] -fied, -fying, -fies to take away the right to participate: The referee disqualified the player after tests showed he had used drugs.",9
disrespect,"/dsrspkt/  n. [U] lack of respect: The customer treated the waiter with disrespect by shouting at him. -adj. disrespectful; -adv. disrespectfully.Thesaurus: disrespect rudeness, impoliteness, discourtesy. Ant. politeness.",9
disruptive,"/dsrptv/  adj. upsetting, disturbing: The angry young man has a disruptive influence on the work of others. -adv. disruptively.",9
dissatisfy,"/dsstsfa/  v. [T] -fied, -fying, -fies to displease, discontent: The violin performance dissatisfied the critical audience. -adj. dissatisfied; dissatisfying.Thesaurus: dissatisfy to disappoint, make unhappy, frustrate, vex. Ant. to satisfy.",9
dissension,"/dsnn/  n. [C;U] a difference of opinion, esp. resulting in argument: There was a great deal of noisy dissension among the arguing committee members.",9
disservice,/dsrvs/  n.sing. an action that creates a problem for s.o.: That company did me a great disservice when they made a mistake that hurt my credit rating.,9
dissidence,"/dsdns/  n. [U] disagreement, opposition: He started a campaign of political dissidence.",9
dissimilar,"/dssmlr/  adj. different, unlike in some way: The girls are identical twins, but dissimilar in that one likes sports and the other does not.",9
dissipated,/dspetd/  adj. foolish and careless in living only for pleasure: Her dissipated lifestyle has destroyed her health. -n. dissipation /dspen/.,9
dissociate,"/dsoiet, si/  v. [T] -ated, -ating, -ates frml. to separate, set apart: The candidate tried to dissociate himself in the minds of the voters from the past failures of his party. -n. [U] dissociation.",9
dissoluble,/dslybl/  adj. capable of being dissolved: Aspirin is dissoluble in water.,9
dissonance,"/dsnns/  n.frml. [U] 1 discord, harsh sound: I dislike the dissonance in serious modern music. 2 conflict, lack of agreement: They ended their marriage because of the dissonance in their relationship. -adj. dissonant.",9
distillate,"/dstlet, lt/  n. the product of distillation: Vodka is a distillate of wheat, corn, or potatoes.",9
distillery,"/dstlri/  n. -ies a business or factory where drinking alcohol, esp. whiskey, is distilled: They own a whiskey distillery in Scotland. -n. distiller.",9
distortion,"/dstrn/  n. [C;U] a change that makes (s.t.) false, (syn.) a misrepresentation: The story she told was a distortion of the truth.",9
distracted,"/dstrktd/  adj. 1 having one's attention pulled away: Distracted from her reading by a noise outside, she ran to the  window. 2 very upset or troubled: The distracted father ran looking for his lost child. -adv. distractedly.",9
distraught,"/dstrt/  adj. very upset, extremely troubled: She was distraught by the death of her aunt.",9
distribute,"/dstrbyut/  v. [T] -uted, -uting, -utes 1 to give out or deal out: The government distributes free food to the poor. 2 to spread out, place at separate points: The population in the desert is distributed over a wide area.Thesaurus: distribute 1 to hand out, issue | allocate, dispense, dole out 2 to scatter, divide up.",9
dockworker,"/dkwrkr/  n. a person who works on the docks, esp. at loading and unloading ships' cargo: The dockworkers unloaded the large crates and moved the freight to the warehouse.",9
dolce vita,"/doltevit/  n.sing. (Italian for) a carefree, pleasure-filled lifestyle: He dreams about living la dolce vita on the French Riviera.",9
do-nothing,  adj. not active or effective: At work she talks and reads the newspaper; she's a do-nothing employee.,9
double-dip,"  v. [I] -dipped, -dipping, -dips  to receive a pension from a company or the government as a retired employee, but continue to work for it and earn more money from it in another position: The retired military  officer works for a civilian branch now as  a consultant, so he's double-dipping. -n. double-dipper.",9
down under,  adv.n.infrml. (in or to) Australia or New Zealand: He left London and sailed <adv.> down under to breed kangaroos.,9
downstairs,/danstrz/  adv. in the direction of or located on floors below: I walked downstairs to answer the doorbell.,9
downstream,"/danstrim/  adv. in the direction of the water's flow, away from a stream's source: The town is located five miles downstream from here.",9
drag queen,  n.slang a male homosexual who wears women's clothes,9
drawbridge,/drbrd/  n. a bridge over a waterway that can be lifted to allow tall ships to pass under it: We had to stop our car while the drawbridge was being lifted.,9
dress code,"  n. requirements as to how  one must dress: The school dress code re-quires white blouses and plaid skirts for  all girls.Usage Note: Dress codes in public schools in the USA are not usually very strict. Children can wear any style of clothing, but are not allowed to wear T-shirts with sexual messages, revealing clothing, or clothing associated with gangs. Many private schools, especially religious and military schools, have much stricter dress codes that make children wear uniforms to school.",9
dressmaker,/drsmekr/  n. a person  who makes dresses: He is a dressmaker to celebrities.,9
dude ranch,"  n. -es a vacation resort like a ranch where city people can experience an outdoor life, esp. horseback riding: Every  summer, we spend two weeks on a dude ranch in Wyoming.",9
duffel bag,"/dfl/  n. a large, heavy cloth bag used for luggage: Soldiers and athletes  use duffel bags to carry their clothes and  belongings.",9
dumbstruck,/dmstrk/  adj. made speechless: I am dumbstruck by the crazy things that he says sometimes.,9
dumbwaiter,/dmwetr/  n. a small elevator for carrying food between a kitchen and a higher floor: The cook puts food on the dumbwaiter and sends it to the upstairs dining room.,9
dump truck,  n. a truck that drops its cargo by lifting its rear bed up: The dump truck poured gravel onto the street.,9
dune buggy,  n. -gies a car designed to travel on sand: She loves racing her dune buggy on the beach.,9
each other,"  pron. an expression showing that each one in a pair or group (of people, animals, or things) does s.t. to the other one(s): The two friends smiled at each other.||The puppies all chased each other.",9
eagle-eyed,  adj. having excellent eyesight: That hunter is eagle-eyed; he can see animals a mile away.,9
early bird,  n.fig. 1 s.o. who gets up early or arrives early: She is at work before the others; she's an early bird. 2 The early bird catches the worm.: the person who is early is usu. rewarded and has an advantage over other  people,9
earthbound,/rband/  adj. restricted to stay on earth: The ostrich is an earthbound bird that cannot fly at all.,9
earthquake,"/rkwek/  n. sudden, violent movements of the earth's surface: The west-ern area of North America suffers from  earthquakes.",9
easy chair,"  n. a soft, comfortable chair meant for relaxation: He reads in his easy chair by the fireplace.",9
economical,"/knmkl, ik/  adj. getting good value for money spent, thrifty: That car burns so much gasoline that it is not economical to own it. -adv. economically.Thesaurus: economical inexpensive, reasonably-priced, cost-effective | cheap, low-priced. Ants. uneconomical | expensive. ",9
ecumenical,/kymnkl/  adj. concerning the unity of Christianity throughout the world: The ecumenical movement is strongly supported by the Pope. -n. ecumenicalism.,9
effeminate,/fmnt/  adj.pej. showing behavior in men that is more typical of women than of men -n. [U] effeminacy.,9
efficiency,/fnsi/  n. -cies good productivity or performance: Management praised the workers for their efficiency.,9
effortless,"/frtls/  adj. easy, not difficult: She skis beautifully; she makes it look effortless. -adv. effortlessly; -n. effortlessness.",9
effrontery,"/frntri/  n.frml. [U] rudeness, (syns.) audacity, gall: That idiot had the effrontery to push ahead of everyone else waiting in line. See: affront.",9
egocentric,"/igosntrk/  adj. selfcentered, selfish: She doesn't consider the  feelings of other people; she's an egocentric person.",9
eight ball,"  n. 1 the black ball with an eight on it in the game  of pool: You must hit the eight ball last in order to win. 2 behind the eight ball: blocked or having bad luck: With no job, he is stuck behind the eight ball and can't do anything to help himself.",9
eighteenth,/etin/  adj.n. the ordinal number 18: She is the <adj.> eighteenth (or) 18th person in line.||She is <n.> eighteenth.,9
elbow room,  n. [U] enough space to work or act freely: Our little apartment is too small; we need a place with some elbow room.,9
electorate,/lktrt/  n. those citizens who can vote: The electorate voted the Democrats into office in 1996.,9
electrical,/lktrkl/  adj. related to electricity: electrical engineering -adv. electrically.,9
electronic,"/lktrnk, ilk/  adj. 1 related to electronics: TVs and radios are electronic devices. 2 related to a flow of electrons -adv. electronically.",9
elementary,"/lmntri, tri/  adj. 1 simple, basic: She is studying elementary mathematics. 2 beginning: We are still in the elementary stage of making our decision.Thesaurus: elementary 1 beginning 2 starting, initial. Ant. advanced.",9
emancipate,"/mnspet/  v. [T] -pated, -pating, -pates to free from slavery, liberate: The Civil War emancipated the slaves in the USA.",9
emasculate,"/mskylet/  v. [T] -lated, -lating, -lates 1 to remove a male's sexual organs, (syn.) to castrate  2 fig. to weaken: Politicians emasculated the new law by making the penalties too light to stop criminals. -n.[C;U] emasculation. See: geld.",9
embankment,/mbkmnt/  n. a mound of earth or rocks built to support the sides of a roadway or to hold back flood waters: The rising water in the river will not flow over the embankment.,9
embodiment,"/mbdimnt, m/  n. [U] s.t. that represents the best, worst, or most typical of s.t. else: The devil is the embodiment of evil.",9
employable,"/mplbl/  adj. 1 ready and able to be employed: She has computer skills and a positive outlook; she's employable. 2 frml. usable, workable: That computer is  employable for accounting purposes. -n. employability.",9
employment,"/mplmnt, m/  n. [U] 1 a job paying a salary or wages: He is out of work and looking for employment. 2 frml. use: The employment of force will lead to greater  violence.Thesaurus: employment a job, work | occupation, business, profession | trade, field. Ant. unemployment.",9
engagement,"/ngedmnt, n/  n. 1 an agreement to marry: We announced our engagement last week. 2 a meeting, appointment: I have an engagement this evening. 3 a battle: The two armies fought an engagement.",9
enrollment,"/nrolmnt/  n. 1 [U] an act of joining, as in a school or class: My enrollment in the fall classes took two hours. 2 [C] the number of students enrolled in a class or school: My English course has an enrollment of 200 students.",9
enterprise,"/ntrpraz/  n. 1 [U] an act that requires courage, hard work, and intelligence, esp. in business: Her business has prospered because of her enterprise. 2 [C] a business, company, esp. a new one: His enterprise is  located in the financial district. -adj.  enterprising.",9
enthusiasm,"/nuzizm/  n. [U] 1 eagerness, zeal: He loves his job; he works with enthusiasm every day. 2 strong interest, general good feeling: You can see the enthusiasm of the employees of that company.Thesaurus: enthusiasm 1 and 2 excitement, passion, love for s.t. Ant. apathy. ",9
enthusiast,"/nuzist/  n. a person full of eagerness for s.t. or s.o.: He is a skiing enthusiast; in the winter, he skis every weekend.",9
entomology,/ntmldi/  n. the study of insects: He's a professor of entomology; spiders are his specialty. -n. entomologist. ,9
equal sign,  n. [U] the symbol (=) that means terms on either side of it are equivalent:  2   2 = 4.,9
equanimity,"/ikwnmti, k/  n.frml. [U] peace of mind, calmness: to have equanimity of mind",9
equestrian,"/kwstrin/  n.adj. a person who rides horses: She is an <n.> equestrian, and she competes in <adj.> equestrian events.",9
equivalent,"/kwvlnt/  adj. equal, the same: The two computers are equivalent in speed.  n. [U] s.t. that is the same: What is the equivalent of one US dollar in Japanese yen? -n. equivalence. ",9
ergonomics,"/rgnmks/  n. [U] the study of the best way to design machines for human comfort, convenience, and business efficiency: She is an expert in computer ergonomics.",9
especially,"/spli/  adv. 1 just (for a special purpose): I bought this present especially for you. 2 to a very great degree, uncommonly: He is especially fond of Swiss cheese.Thesaurus: especially 1 solely, only, exclusively  2 particularly, extraordinarily, above all. Ant. not especially.",9
estimation,"/stmen/  n. [U] evaluation of worth, (syn.) appraisal: In my estimation, she is a good administrator.",9
eucalyptus,"/yuklpts/  n. -tuses or -ti /ta/ [C;U] a tall tree originally from Australia that provides wood, oil, and gum",9
euthanasia,"/yune/  n. [U] the killing of a person who is suffering from an incurable illness, (syn.) mercy killing",9
evaluation,"/vlyuen/  n. [C;U] 1 an analysis, study: An accountant did an evaluation of the company's financial health. 2 estimate of worth (ability, value, etc.): My boss did an evaluation of my job performance.",9
evenhanded,"/ivnhndd/  adj. treating people justly, fair: The judge is evenhanded; she treats the poor and the rich with equal justice. -adv. evenhandedly.",9
everything,"/vri/  pron. 1 all things: Everything in the kitchen was destroyed by the fire. 2 all that is important in life: Her health is everything to her.Thesaurus: everything 1 all, the whole lot 2 the whole world, the main thing or concern. Ant. nothing. ",9
everywhere,"/vriwr/  adv. in all places: I lost my keys and looked everywhere for them.Thesaurus: everywhere all over, all over the place, far and wide. Ant. nowhere.",9
eviscerate,"/ivsret/  v. [T] -ated, -ating, -ates to cut the insides out of, to gut: The hunter eviscerated the dead deer. -n. evisceration.",9
exacerbate,"/gzsrbet/  v. [T] -bated, -bating, -bates to make worse, (syn.) to aggravate: I hurt my foot, and walking on it exacerbated the pain.",9
exaggerate,"/gzdret/  v. [I;T] -ated, -ating, -ates to say s.t. is better, worse, more important, etc., than it really is, overstate:  He said he caught a fish as long as his arm,  but I think he was exaggerating. -n. [U]  exaggeration.Thesaurus: exaggerate to inflate s.t., magnify, tell tall tales | make a mountain out of a molehill. Ant. to downplay s.t.",9
exasperate,"/gzspret/  v. [T] -ated, -ating, -ates to anger and frustrate: Time after time, he refused to cooperate; he exasperated me completely. -n. [U] exasperation; -adj. exasperating.",9
excise tax,"/ksaz/  n. taxes in USA, a fee or tax on certain products or licenses: Governments place excise taxes on tobacco and liquor.",9
excitement,"/ksatmnt/  n. [U] a strong, pleasant feeling (syn.) exhilaration: The children felt great excitement on the rollercoaster ride.",9
exhausting,"/gzst/  adj. very tiring: I've had an exhausting day, so I'm going to bed.",9
exhaustion,"/gzstn/  n. [U] complete tiredness, fatigue: She worked all night and is suffering from exhaustion.",9
exhaustive,"/gzstv/  adj. complete, thorough: A committee made an exhaustive study of the labor problem and gave recommendations. -adv. exhaustively.",9
exhibition,"/ksbn, gz/  n. 1 a display (of art, products, etc.): I enjoyed the art exhibition at the museum. 2 to make an exhibition of oneself: to behave in a way that causes embarrassment: He drank too much and made an exhibition of himself at the  wedding.",9
exhilarate,"/gzlret/  v. [T] -rated, -rating, -rates to make s.o. feel strong and happy, (syns.) to invigorate, enliven: The cold autumn air exhilarates me. -adj. exhilarating; -n. [U] exhilaration.",9
exorbitant,"/gzrbtnt/  adj. much too high, (syns.) excessive, outrageous: During the lettuce shortage, many stores charged exorbitant prices for it. -n. [U] exorbitance.",9
expatriate,/kspetrit/  n. 1 a person from one country who lives in another country  2 a person who gives up (renounces) his or her country: A group of expatriates from the USA live in Paris.,9
expedition,/kspdn/  adj. a journey usu. made by a group organized and equipped for a special purpose: Admiral Byrd made  an expedition to reach the North Pole. -adj. expeditionary.,9
expendable,"/kspndbl/  adj. not needed, (syn.) dispensable: When traveling, things  that seem necessary at home may become  expendable.",9
experience,"/ksprins/  n. 1 [U] an event, a happening: Our visit to Alaska was a pleasant experience. 2 [U] understanding gained through doing s.t.: She has years of experience in teaching.  v. [T] -enced, -encing, -ences to feel or know by personal involvement in: She has experienced difficulties (satisfaction, success, etc.) in her new job.Thesaurus: experience n. 1 an affair, episode, occurrence 2 practice, training, personal knowledge. Ant. inexperience.  v. to be involved in s.t., sense, feel. Ant. to miss s.t. ",9
experiment,"/ksprmnt, mnt/  n. 1 a test done to see if s.t. works or happens: We do experiments in chemistry class each week. 2 a test project undertaken to see whether more of s.t. should be done: We marketed the product in five cities as an experiment to see if we should market it nationwide.  v. [I] 1 to test: We experimented with magnetism in the physics laboratory. 2 to try s.t.: The company experimented with different sales techniques. -n. [U] experimentalism; [U] experimentation.Thesaurus: experiment n. 1 a procedure, research 2 a tryout, an exploration. v. 1 to research, follow procedures 2 to try s.t. out, explore s.t. Ant. to remain inactive.",9
expiration,"/kspren/  n. [U] a date at which s.t. is no longer valid: The expiration of my passport (driver's license, credit card, etc.) meant I had to get a new one.",9
explicable,"/ksplkbl, kspl/  adj. capable of being explained: That situation is explicable if you understand the motives of the people involved.",9
exposition,"/kspzn/  n. 1 [C] a show where manufacturers display their products: We attended a computer exposition (or) expo at the Trade Center. 2 [C;U] a written work of explanation, an essay: She wrote an exposition of her views on politics.",9
expository,"/kspztri/  adj. serving to explain, explanatory: The students are taking a course in expository writing.",9
expression,"/ksprn/  n. 1 [C] the look on one's face: You should have seen his expression when we gave him a surprise party. 2 [C;U] a sign, demonstration: He sent her roses as an expression of his love. 3 [C] a group of words, a statement, (syn.) an idiom: When you tell s.o. to ""break a leg,"" it is just an expression meaning ""good luck."" 4 in math, a phrase that defines a quantity that is not a complete equation: The expression 9/5 C   32 tells the temperature.  ",9
expressive,"/ksprsv/  adj. showing obvious emotion: His gestures (speech, laughter, etc.) were very expressive of the happiness he felt. -adv. expressively.",9
expressway,/ksprswe/  n. a superhighway usu. with six to eight lanes and few roads leading to it: The expressway takes you into Boston quickly and avoids all those back streets.,9
extinguish,"/kstgw/  v. [T] to stop, put out: Firefighters extinguished a fire.",9
extraction,/kstrkn/  n. [C;U] removal  of a tooth: The dentist did the extraction quickly.,9
extraneous,"/kstrenis/  adj. unneeded, (syn.) superfluous: The report contained extraneous information of no use to anyone. -adv. extraneously.",9
eye shadow,  n. [U] cosmetics used mainly on the upper eyelid to highlight the eyes: She uses blue eye shadow.,9
eyeglasses,/aglsz/  n.pl. a pair of lenses in a frame used for better sight: She wears eyeglasses for reading.,9
eye-opener,  n. s.t. that surprises or shocks: The scandal at the bank was an eye-opener.,9
eyewitness,"/awtns/  n. -nesses a person who saw an event happen, esp. a crime: The two eyewitnesses to the theft testified in court.",9
face cloth,"  n. a small towel used to wash one's face, (syn.) washcloth: I wash my face with a face cloth every morning.",9
face value,"  n.frml. 1 [U] the truthfulness of s.t. as it appears on the surface: I accept what he says at face value because he is an honest man. 2 [C] the value written on a stock or bond versus its market value: The face value of the bond is $1,000, but its market value is only $900.",9
facilitate,"/fsltet/  v. [T] -tated, -tating, -tates to help, (syn.) to expedite: The tourist office sent us a guide who facilitated our travel through Japan.",9
Fahrenheit,"/frnhat, fr/  adj. a system of measuring temperature in which water freezes at 32° and boils at 212°: The temperature is 90 degrees Fahrenheit this afternoon; it's really hot! See: Centigrade; Celsius.",9
