word,definition,weight
pay,"/pe/  v. paid /ped/, paying, pays 1 [I;T] to give money to s.o. in return for regular work: That company pays its employees every two weeks. 2 [T] to settle a bill, debt, or loan by giving what is owed: She paid the doctor's bill by writing a check. 3 [I] to be worthwhile, to one's advantage: It pays to brush your teeth to prevent cavities. 4 to pay attention: to observe and listen closely: The teacher told the students to pay attention to her in class. 5 to pay a compliment: to say nice things about s.o. or s.t.: I want to pay my compliments to you on your new home. 6 to pay a visit: to go to see and talk with s.o.: When I went to my homeland, I paid a visit to my old friend. 7 phrasal v. insep. [T] to pay for (s.t.): to suffer from the results of one's actions: I walked five miles (8 km) on Sunday and am paying for it now; my legs hurt! 8 to pay one's dues:  a. to pay for membership in a club or union   b. fig. to earn one's place in an organization through long and patient service: He paid his dues as a traveling salesman, and now he has a good office job. 9 to pay one's way: to support oneself, pay for food, rent, clothing, etc.: She has a good job and pays her own way in life. 10 to pay s.o.: to be good/profitable for s.o. to do s.t.: That company has job openings, so it would pay you to look for one there. 11 phrasal v. sep. [T] to pay s.o or s.t. back: a. s.o.: to return an insult or injury: He yelled at her, and she paid him back by not speaking to him for a week. b. s.t.: to repay a loan, return money: I paid back the $10 that my friend loaned to me. 12 phrasal v. sep. to pay s.o or s.t. off: a. [T] s.o.: to bribe: The criminals paid off the judge and got away free.||They paid her off. b. [T] s.t.: to finish paying for s.t.: I finally paid off the 30-year mortgage on my house.||I paid it off. c. [I] to produce good results: Her hard work paid off when she got a big raise. 13 phrasal v. sep. [T] to pay s.t. down:  a. to reduce the amount of a debt: I am paying down my car loan each month.||I am paying it down. b. to make a first partial payment: I paid some money down on a new TV and will pay off the rest monthly. 14 infrml. to pay the piper: to pay for doing s.t. that you thought you could avoid paying for: She cheated on her taxes for years, but she was caught; now it's time to pay the piper by going to jail. 15 infrml. to pay through the nose: to pay a very high price for s.t.: He only shops at fancy stores, and so ends up paying through the nose. 16 phrasal v. [I] to pay up: to  pay money that is due: He was three months overdue in paying the rent, and the landlord told him to pay up.  n. [U] money paid in return for work done: She refused to take the job because the pay was too low.",9
PDA,"  abbr. for personal digital assistant n. a small, handheld computer used as a notepad, address book, calendar, cell phone, and for  e-mail: My PDA fits easily in my briefcase.",9
pea,"/pi/  n. 1 a small, round, green seed that grows in long pods and is eaten as a vegetable  2 the creeping and climbing plant on which peas grow: We plant peas in early spring. 3 as like as (or) like two peas in a pod: a. exactly alike: Those twins are as like as two peas in a pod. b. close together, friendly: Those old friends are like two peas in a pod.",9
pee,"/pi/  v. [I] n. slang [U] peed, peeing, pees to urinate: He <v.> peed behind a tree.||He went outside to take a pee.",1
peg,"/pg/  n. 1 a small rod made of metal or wood that fits in a hole and is used to hang things on, hold things together, or mark a place: He hung his hat on a peg in the door.||The door hinge has a peg in it. 2 a square peg in a round hole: s.o. or s.t. that does not fit in: At school, she felt like a square peg in a round hole. 3 to take s.o. down a peg: to show that s.o. is less important than he or she thought: He was rude to her, so she took him down a peg by criticizing his work.  v. [T] pegged, pegging, pegs 1 to attach or fasten using pegs: He pegged a poster to the wall. 2 to set a value for s.t.: He pegged the price of his house at $200,000. 3 infrml.fig. to evaluate s.o., know what they are like: I have him pegged as a lazy fellow.",9
pep,"/pp/  n.infrml. cheerful, active energy, (syn.) vigor: She leads the team with a lot of pep. -adj. peppy. v. [T] pepped, pepping, peps phrasal v. sep. to pep s.t. up: to make things happy, full of energy: Whenever she comes to our house, she peps up the party.||She peps things up.",9
per,"/pr/  ; weak form /pr/prep. 1 for one, for each: That bread costs $3.00 per pound. 2 as per: according to, in agreement with: As per your instructions, we are sending the package to your home address.",9
pet,"/pt/  n. 1 a tame animal kept in the home and treated with kindness and affection: Dogs are very popular as pets. 2 a favorite person: That bright girl is the teacher's pet.  adj. 1 kept or treated as a pet: She has six pet cats. 2 favorite, special: His pet topic is politics.||a pet theory 3 showing affection: My pet name for her is ""Pumpkin."" See: pet peeve. v. petted, petting, pets 1 [T] to stroke lightly and fondly with the hand: She pets her cat on its back. 2 [I] to kiss and caress for sexual pleasure: Teenagers at the party petted on the couch. -n. [U] petting.",9
pew,/pyu/  n. a bench (a long seat with a back) in a church: We sat in the third pew.,9
pie,"/pa/  n. 1 [C;U] a food dish of fruit, meat, or other foods cooked in a pastry crust: Would you like some apple pie for dessert? 2 infrml. as easy as pie: very easy: Riding a bike is as easy as pie. 3 to have a finger in every pie: to be involved in many different projects: She is a very active manager and has a finger in every pie. 4 infrml. pie in the sky: a desirable but unrealistic idea or plan: They say we will build a new office, but I think that's pie in the sky.Usage Note: Apple pie is a traditional American dessert. People say ""as American as apple pie"" to refer to something that is very American: Baseball was invented in the United States; it's as American as apple pie.",9
pig,"/pg/  n. 1 a common farm animal of the swine family, valued for its meat, with a fat round body, thick skin, short nose, legs, and tail: A big, fat pig cannot run fast. 2 the meat of a pig: pork, ham, or bacon  3 pej. a fat, impolite, or offensive person who eats too much: I will never invite that man to dinner because he is a pig. phrasal v. insep. [I] to pig out on s.t.: to take pleasure in eating too much: After school, he pigged out on pizza and ice cream.Thesaurus: pig n. 1 a hog, swine 3 a glutton, hog.Usage Note: When pigmeat is eaten, it is called pork, ham, or bacon; it is not called pig.",1
ply,"/pla/  n. a layer of material: Two-ply paper towels are stronger than single-ply towels.  v. [T] plied, plying, plies 1 to work at a trade: He plies his trade as a locksmith. 2 to travel over: Merchant ships ply the waters between the Americas and Europe.",9
PMS,/piemes/  n. abbr. for premenstrual  syndrome,9
pod,"/pd/  n. a long, narrow case in which seeds grow on certain plants, such as peas and beans: I took the peas out of their pods before I cooked them.",9
pop,"/pp/  n. 1 the sharp sound of s.t. bursting or exploding: You could hear the pop of firecrackers during the celebration. 2 infrml. a friendly term for one's father or an elderly man: My pop recently retired from work. 3 a soft drink See: soda, USAGE NOTE. v. popped, popping, pops 1 [I;T] to burst suddenly with a loud noise: The popcorn popped as it cooked. 2 [I;T] to open or burst abruptly: A button on his shirt popped off. 3 infrml. to pop the question: to ask s.o. to marry you: He finally got up enough courage to pop the question to his girlfriend.  adj. short for popular, related to ordinary people: Pop culture includes television, movies, sports, and rock and roll music.",9
pot,"/pt/  n. 1 a container made of metal, glass, or ceramic and used for cooking: The potatoes are boiling in a pot of water. 2 a round container, esp. made of clay: She has pots on her balcony to hold flowers. 3 slang marijuana   4 infrml. the pot: all the money bet by the players at one time in a card game: He won the pot at poker. 5 infrml. to go to pot: to fall apart: That company has gone to pot; it will probably go out of business soon.  v. [T] potted, potting, pots to put live plants in a pot: She pots plants from her garden to put on her balcony.",9
POW,/piodblyu/  n. abbr. for prisoner of war,9
pox,"/pks/  n. [U] a disease, such as chicken pox or smallpox, that causes sores on the skin",1
pry,"/pra/  v. pried, prying, pries 1 [I;T] to loosen or open s.t. with force: He pried off the top of a paint can with a screwdriver. 2 [I] to be nosey, look into s.o. else's personal life closely: He pried into his daughter's love  life so closely that she stopped telling him  anything.",9
pub,"/pb/  n. a bar that often serves simple food: She went to a pub for a hamburger and beer. See: bar, USAGE NOTE.",8
pun,"/pn/  n.v. [I] punned, punning, puns a joke using words with similar sounds or two different meanings: A pun is, for example: ""I have a weak back that I hurt about a week back""; ""weak"" and ""week"" have the same sound but different meanings and ""back"" means ""the human back"" and in"" the past.""",9
pup,"/pp/  n. short for puppy, a baby dog or seal: Our dog gave birth to three pups today.",9
pus,"/ps/  n. [U] the white, sticky liquid that forms in an infected wound: A nurse gently cleaned the pus from the injury on my hand.",9
put,"  putv.put, putting, puts1 to place, move s.t.:I put the book on the shelf.||She put her paycheck in the bank.  2 to cause s.o. to experience s.t.: The doctor put him under observation.  3 to arrange, organize s.t.:Before going on his trip, he put his affairs in order, like stopping delivery of the newspaper.  4 to cause problems for others: He put the typist to a lot of trouble by making many changes in a letter he wrote.  5 to apply, use: She put her knowledge of accounting to use in figuring out her taxes.  6 o express, say: i>To put it mildly, the rainy weather has been terrible lately.  7 phrasal v. to put about: (with boats) to turn, esp. back: We saw a bad storm ahead and we put about for our home port. 8 phrasal v. insep. to put in for s.t.: to apply, request: A soldier put in for a transfer to another army post. 9 infrml. to put one's best foot forward: to make one's best effort or appearance: You should dress nicely and put your best foot forward when you go to a job interview. 10 to put one's mind to: to work hard at s.t.: When she puts her mind to it, she is very helpful in solving problems. 11 phrasal v. sep. to put s.o. away: to send to jail or a mental hospital: His family put away my mentally ill neighbor. 12 phrasal v. sep. to put s.o. or s.t. down: to criticize, say bad things: He puts down his coworkers by saying that they don't know what they are doing. 13 phrasal v. sep. to put s.t. forth or forward: to offer for consideration, propose: A politician put forth the idea that patriotism is important to the country.||She put it forth. 14 phrasal v. sep. to put s.t. in: to contribute, pay: We each put in $10 to buy a gift for our friend who is leaving.||We put it in. 15 to put s.t. in perspective: to be reasonable about s.t., understand and accept s.t.: Hearing of her friend's tragedy helped her put her own problems in perspective. 16 phrasal v. sep. to put s.o. or s.t. off: a. s.o.: to annoy or disgust: His bad manners put off people and they avoided him. b. s.o. or s.t.: to postpone, delay: Our meeting for today was put off until tomorrow.||We put it off. 17 phrasal v. sep. to put s.o. or s.t. on: a. s.o.: to trick or tease s.o. by making believe s.t.: He wasn't being serious; he was just putting her on. b. s.t.: to dress: She put on her coat and hat.||She put them on. 18 phrasal v. sep. to put s.o. or s.t. out: a. s.o.: to annoy, irritate: He was really put out that she did not show up for their date. b. s.t.: to take outside: He put out the trash. c. s.t.: to extinguish a fire: Firefighters put out the fire with a water hose. 19 phrasal v. sep. to put s.t. over: to trick, deceive: He put one over on his neighbor by borrowing a hammer and never returning it. 20 phrasal v. sep. to put s.o. through s.t.: to cause s.o. to suffer s.t.: His boss put him through a difficult period. 21 to put to the test: to make s.t. or s.o. perform to see how well they do: She claimed that she could speak Spanish, so the job interviewer put her to the test and started speaking Spanish with her. 22 phrasal v. to put through: a. to approve, process s.t.: The consulate put through my application for a visa to visit France. b. to connect a telephone call   23 phrasal v. sep. to put s.o. up: to give s.o. hospitality: They put me up for the weekend when I was in London. 24 infrml. to put up or shut up: to be willing to support what one says with money or action: You say that you can run faster than anyone else. Well, put up or shut up; let's race for money right now! 25 phrasal v. insep. to put up with s.o. or s.t.: to tolerate, accept: She puts up with the loud noise of living in the city because the city is so exciting.  adj. 1 put out: annoyed, irritated with s.o.: I am put out with my friend because he is late again. 2 put upon: taken advantage of: When her grown son keeps asking her for money, she feels put upon. 3 to stay put: not to move, stay still: I told my friend to stay put while I went to the store to buy food.",9
rag,"/rg/  n. an old piece of cloth: I use a rag to dust the wooden furniture.  v.infrml.fig. [T] ragged, ragging, rags to kid, tease s.o.: My friend ragged me about flunking an exam.",1
ram,"/rm/  n. 1 a male sheep: Rams butt heads during  the mating season. 2 RAM abbr. for random-access memory: My computer has 16 megabytes of RAM.  v. [T] rammed, ramming, rams 1 to hit with great force: A car went off the road and rammed into a tree. 2 infrml.fig. to ram s.t. down s.o.'s throat: to force s.o. to do s.t.: She did not want to fire some of her workers, but her boss rammed the order to fire them down her throat.Usage Note: A computer's RAM is the memory the computer uses to hold programs. A computer with more RAM can run larger, more complicated programs. More RAM allows the use of detailed graphics, sound, and other powerful programs. Usually a computer with more RAM works faster, too. Having a lot of RAM is like having a large desk on which you can organize all of your information to use it easily.",9
ran,/rn/  v. past tense of run,9
rap,"/rp/  n. 1 [C] a knock, loud tap: I heard a rap on the door, and I opened it. 2 [C] slang the qualities or character (usu. negative)  people believe s.o. to have, (syn.) reputation: He has a bad rap as a thief, but actually he is honest. 3 slang one's ability to talk well and at length: She has a good rap once she starts talking. 4 [U] a type of music in which the artist speaks to a strong rhythm: Rap became popular in the 1980s.  v. rapped, rapping, raps 1 [I;T] to knock, tap loudly: My friend rapped on my door, and I let her in. 2 slang [I] to talk about s.t. a lot: We rapped about going to college and decided to apply. 3 infrml. to take the rap: to receive punishment for the wrongdoing of s.o. else: The top mobster was responsible for the crime, but an underling took the rap and went to jail.Usage Note: People who perform rap music are called rap artists, not rap musicians, because a rap performance combines dancing, talking, and singing in rhyme. Recently, some rap artists have been criticized for using violent words and ideas, but other artists use rap music to tell about life in American cities.",9
rat,"/rt/  n.v. [I] ratted, ratting, rats 1 a kind of rodent with a long hairless tail, a pointed nose, and very sharp teeth: <n.> Rats look like mice, but are larger. 2 slang to tell people in power about a person's illegal or unprofessional acts; a person who does this: Don't be a <n.> rat and <v.> rat to the boss that I was late. 3 to smell a rat: to sense that s.t. is wrong: The news reporter smelled a <n.> rat when the mayor refused to let her see the records of city office meetings. See: rat race.",9
raw,"/r/  adj. 1 natural, uncooked: Eating raw carrots is good for your eyesight. 2 in a natural state, not yet manufactured: Cotton and wool are raw materials from which cloth is made. 3 very clearly or openly sexual, crude: Pornographic magazines show raw sex. 4 painful red areas where skin has been rubbed away: The skin on my feet is raw because my shoes are too small. 5 untrained, not yet tested: In the army, all raw recruits must go to training camp first. 6 being very cold and wet: raw weather in the winter 7 infrml. in the raw: in a natural state, unclothed, naked, nude: Nudists spend a lot of their time in the raw. 8 infrml. raw deal: an unfair exchange, a cruel trick: They gave him a raw deal; they hired him to do a job and then didn't pay him for it.Thesaurus: 1 unprocessed | fresh. Ant. cooked.  2 natural, unprocessed, unrefined. 3 pornographic, raunchy infrml. 4 scraped, tender, sore 5 beginning, inexperienced. 6 bitter cold.",9
ray,"/re/  n. 1 a thin line of light, energy, or heat: Rays of light shine from a burning candle. 2 a small amount of s.t.: There is a ray of hope that he will be cured of cancer.Thesaurus: ray 1 a beam, shaft 2 a flicker, glimmer.",9
Rd.,"/rod/  abbr. for Road: His address is 21 Fordham Rd. See: street, USAGE NOTE. ",1
red,"/rd/  n.adj. 1 [C;U] a basic color like that of blood: She likes to wear <n.> red and  has several <adj.> red suits. 2 to be in the red: to be in debt: Our company was making money, but now it's in the red. See: black, n., 4.  3 to see red: to be very angry: My father will see red when I tell him I wrecked his car. ",9
REM,"/rim/  n. short for Rapid Eye Movement, a type of sleep whereby one dreams and the eyeball moves quickly: Doctors believe that REM is very important for a good night's sleep.",9
rep,/rp/  n.infrml. short for representative: Sales reps visit our company to sell their  products.,9
rev,"/rv/  v. [I;T] revved, revving, revs to speed up an engine: A race car driver revved his engine at the starting line.",9
rib,"/rb/  n. 1 any of the many horizontal curved bones in the front of the chest that form the rib cage: He fell and broke a rib. 2 anything similar in shape to a rib: Cardboard with ribs bends easily in one direction, but is difficult to bend in the other direction. 3 a piece of meat containing a rib: We had beef ribs for dinner.  v.infrml.fig. [T] ribbed, ribbing, ribs to laugh at s.o., kid, tease: His friends ribbed him about his big feet.",9
rid,"/rd/  v. [T] rid or ridded, ridding, rids 1 to free, relieve: She rid herself of bad habits, like smoking cigarettes. 2 to be rid of: to be free of, relieved of: She was glad to be rid of both the bad habit and the expense of smoking. 3 to get rid of s.t. or s.o.: to free oneself of, throw away, (syns.) to dispose of, eliminate: She got rid of her old clothes by giving them to the poor.Thesaurus: rid 1 to liberate, shake off, eradicate.",9
rig,"/rg/  v. [T] rigged, rigging, rigs 1 to cheat, arrange events dishonestly to one's advantage: A politician rigged the election by having votes of dead people counted for him so he would win. 2 to put up rigging, put sails, ropes, etc., on a ship: A captain rigged his ship with new sails. 3 infrml.fig. to dress oneself: He rigged himself for the party with his new shoes and a colorful shirt. 4 phrasal v. sep. to rig s.t. up: to put up s.t. in a way that is not permanent: He rigged up an antenna for his radio by hanging a wire over a tree branch.||He rigged it up.  n. a piece of equipment, esp. a large truck: That truck driver bought a new rig.",1
rim,"/rm/  n. the outside edge or border of s.t. (usu. round): A spoon rested against the rim of the bowl.  v. [T] rimmed, rimming, rims (in basketball) to slide off and not enter the rim of s.t.: The basketball rimmed the basket and fell to the floor.",9
rob,"/rb/  v. [T] robbed, robbing, robs to steal s.t. from s.o., take s.t. from s.o. illegally: A thief robbed three houses on our street.",9
rod,"/rd/  n. a narrow, cylindrical piece of material (of metal, wood, or plastic): Long steel rods are used to reinforce concrete columns in new buildings.",9
roe,/ro/  n. [U] 1 a type of deer  2 fish eggs: Salmon swim upstream to lay their roe each year.,9
rot,"/rt/  n. [U] a state of decay, esp. caused by disease, or after death: Rot in the tree trunk caused the tree to fall.  v. [I;T] rotted, rotting, rots to break down into biochemical parts, usu. after death: Dead plants rot and become part of the soil again.Thesaurus: rot v. to decay, decompose | spoil.",9
rub,"/rb/  v. rubbed, rubbing, rubs 1 [I;T] to touch s.t. while moving backwards and forwards: A mother rubbed her child's back. 2 [T] to put s.t. on using a cloth and pressure: I rubbed wax on the table so it would shine. 3 phrasal v. sep. [T] to rub s.t. away: to push or brush aside: A mother rubbed away the tears of her child when he hurt his knee.||She rubbed them away. 4 phrasal v. sep. [T] to rub s.o. or s.t. down: to make smooth through rubbing: Rub down the table with sandpaper.||Rub it down. 5 infrml.fig. to rub elbows with s.o.: to be in contact with people: When you ride the subway in New York City, you rub elbows with people from all over the world. 6 phrasal v. sep. [T] to rub s.t. in or into:  a. to apply liquid to a surface by rubbing: The nurse rubbed lotion into my skin. b. to remind s.o. of a mistake or other failing many times: His father rubbed in his failure to pass exams nearly every day.||He rubbed it in. 7 phrasal v. insep. [I;T] to rub off on s.o. or s.t.: a. s.o.: to make others feel the same way, (syns.) to affect, influence: Her cheerfulness rubs off on everyone she meets and makes them happy. b. s.t.: to come off on a surface after rubbing: He rubbed some paint off on a rag. 8 phrasal v. sep. slang [T] to rub s.o. out: to kill, murder s.o.: A gangster rubbed out a man who gave information to the police by shooting him.||He rubbed him out. 9 infrml.fig. to rub s.o. the wrong way: to make s.o. feel angry or uncomfortable, (syns.) to annoy, irritate: His rude behavior rubs people the wrong way. See: caress, USAGE NOTE. n. 1 an act of rubbing s.o. or s.t.: After exercise, he gives his legs a rub with alcohol. 2 sing.infrml.fig. a difficulty, problem: The rub with buying something on the Internet is that some people are scared to give out their credit card number.",9
rue,"/ru/  v.frml. [T] rued, ruing, rues to feel badly about s.t., (syn.) to regret: He rued the day that he rode the motorcycle, because he fell off and broke his leg. -adj. rueful.",1
rug,"/rg/  n. a heavy fabric floor covering: They have a beautiful Oriental rug on their floor.Thesaurus: rug a carpet, carpeting | throw rug.",9
rum,/rm/  n. [U] a strong alcoholic drink made from sugar cane: Puerto Rico is famous for its light and dark rum.,9
run,"  /rn/ v. ran /rn/, run, running, runs 1 [I] syn. to sprint: Every morning, he runs around",9
rye,/ra/  n. [U] a cereal grain used to make flour and whiskey and to feed animals: Rye is planted both in the autumn and in the spring.,9
"S,s","/s/  n. S's, s's or Ss, ss the 19th letter of the English alphabet",9
sad,"/sd/  adj. sadder, saddest 1 full of sorrow, unhappy: After her mother's death, she was sad for many months. 2 (s.t.) unfortunate,  regrettable: Being poor is a sad situation. 3 bad,  lamentable: The business lost lots of money; it's now in sad condition. -adv. sadly; -n. sadness.",9
sag,/sg/  n. a low or loose area in s.t.: All of the snow has caused a sag in the roof of our house. See: dip. v. [I] 1 to bend or sink downward from weight or pressure: The tent sagged under the weight of the wet snow. 2 to feel and look tired and depressed: Business is so bad that the workers' spirits are sagging.,1
sap,"/sp/  n. 1 [U] the liquid that flows through plants to keep them alive and healthy: We collect sap from maple trees to make syrup. 2 [C] infrml. a rather stupid person who foolishly believes everything: Don't be a sap; that guy is lying to you.  v. [T] sapped, sapping, saps to remove (energy, strength, etc.): He has cancer, and the disease saps his strength. -adj. sapped.",9
saw,"/s/  v. [I;T] n. 1 a tool or machine with a sharp, rough edge and handle used for cutting wood or metal: The man <v.> sawed some wood for the fire. 2 old saw: an old, unoriginal idea: Don't believe the old saw ""an apple a day keeps the doctor away."" See: adage.",9
say,"/se/  v. said /sd/, saying, says /sz/ 1 [T] to express  in words from the mouth: If  you don't like me, then say it. 2 [I;T] to express thoughts in writing or another nonspoken way: I said what I felt in a love letter.||Your eyes are saying you love me, too.  n. [C;U] an opinion to express: I have a say in how much to spend; I think we should spend $90.",9
sea,"/si/  n. 1 [C] a body of salt water, smaller than an ocean: The Caspian Sea is between Europe and Asia. 2 [U] the part of the earth covered with water (opposite of land): We traveled over land and sea. 3 [C] usu. sing. a large group of people or things: We saw a sea of people in the square. 4 to be at sea:  a. to be on a boat in open water: The ship is at sea now; it left port two days ago. b. fig. to be in doubt, emotionally lost: The young man is at sea about what to do with his future. 5 to be on the high seas: open water: The ship is in the mid-Atlantic on the high seas.",9
