word,definition,weight
hoe,"/ho/  n.v. [I;T] hoed, hoeing, hoes a digging tool with a metal blade on a long handle: I use a <n.> hoe to <v.> hoe weeds from my garden.",9
hog,"/hg, hag/  n. 1 a large domesticated pig: Hogs are raised for ham, pork, bacon, and lard. 2 fig. s.o. who eats or takes a lot of s.t.: He's a real hog with the ice cream. 3 infrml. to go whole hog: to do s.t. completely v. [T] hogged, hogging, hogs to take more than one's share of s.t.Thesaurus: hog n. 1 a swine  2 a pig, greedy person, glutton.",1
hop,"/hp/  n. 1 a forward jump: The girl took little hops down the sidewalk. 2 a quick trip: San Diego is a short hop from Los Angeles.  v. [I] hopped, hopping, hops to move with a hopping motion: Rabbits hop very quickly.",8
hot,"/hat/  adj. hotter, hottest 1 having a high degree of heat, burning: The water is very, very hot. 2 warm, sultry: The weather is hot today. 3 spicy, highly seasoned: My food is hot because I added lots of red peppers to it. 4 angry, agitated: We started to argue, and tempers got hot. 5 infrml. sexually aroused: The couple started kissing, then got hot. 6 popular, sought after: Short skirts are the hot fashion this season. 7 selling fast: Cowboy boots are a hot item in our store. 8 infrml. stolen: He was arrested for selling hot merchandise. 9 doing or performing well: That comedian is really funny; he's hot tonight. 10 hot and bothered: easily upset, worried by s.t.: When she gets lost driving her car, she gets all hot and bothered but won't ask for directions. 11 infrml. hot on s.o.'s trail: close behind, in pursuit of s.o.: The police were hot on the bank robber's trail. 12 infrml. hot under the collar: angry, (syn.) agitated: He gets hot under the collar if you don't agree with him. 13 infrml. in hot water: in trouble, difficulty: He stole a car and is in hot water with the law. 14 to blow hot and cold: to go back and forth, (syn.) to vacillate: She blows hot and cold about changing jobs. See: warm, USAGE NOTE. n.pl.infrml. to have the hots: to be attracted to: They have the hots for each other.",9
how,"/ha/  adv. 1 in what manner: How do you fix this broken faucet? 2 for what reason: How can you say such an awful thing? 3 in what condition: How do you feel? 4 to what extent, cost: How much does this sofa cost? 5 by what description, designation: How do you describe this object? 6 as part of a greeting: How do you do? 7 infrml. how about: what do you think about (s.t.): I couldn't decide what to wear, then asked her, ""How about this dress?"" 8 infrml. How come?: Why?: How come you didn't call me yesterday?  conj. the way in which: I remember how she laughed at his jokes.",9
hub,/hb/  n. 1 a wheel's center where the axle is inserted 2 a center of much activity: Chicago is a hub of airline traffic.,9
hue,"/hyu/  n. graduation of color, as in red to yellow: The hues of the leaves in autumn are beautiful against a blue sky.",9
hug,"/hg/  n. an embrace, the act of putting one's arms around s.o.: He gives his children a hug and a kiss as they leave for school.  v. hugged, hugging, hugs 1 [I;T] to encircle s.o. with the arms: She hugged her children. 2 [T] to stay near the shoreline: The sailboat hugged the coast in the strong wind.",9
huh,"/h/  exclam. 1 expressing a question: Huh? What did you say? 2 expressing indifference: Oh, huh, I don't care what we do. 3 expressing surprise: Huh! What a great idea!",1
hum,"/hm/  v. hummed, humming, hums 1 [I] to make a continuous sound of ""M"": Bees hum when they fly. 2 [I;T] to sing with the mouth closed: He hummed a tune as he walked to work. 3 fig. [I] to work smoothly and well: Our business is humming right along.  n. a humming sound, the sound of a smooth operation: You can hear the hum of activity in that business.",9
hut,"/ht/  n. a cabin, a small, shabby shelter: People live in huts in that poor area. See: hovel; hutch, 2.Thesaurus: hut a shack, shanty, hovel | bungalow, cottage.",9
"I,i","/a/  n. I's, i's or Is, is 1 the ninth letter of the English alphabet  2 fig. to dot the i's and cross the t's: to agree on small details: The agreement is nearly final, except that we have to dot a few i's and cross a few t's.  pron. first-person singular, used in speaking or writing to refer to oneself: I wish I could stay longer.",9
ice,"/as/  n. [U] 1 frozen water: Ice forms on the roads in winter. 2 to break the ice: to make people comfortable at a first meeting: Let's play a game to break the ice. See: icebreaker. 3 to put on ice: a. to make cold or freeze: We put some soda on ice to chill it. b. infrml.fig. to stop or delay, (syn.) to shelve: The project has too many problems, so we put it on ice for a while.  v. 1 [I] to form ice: When it is very cold, the wings of an airplane ice. 2 [T] to cover or decorate a cake with icing  3 to ice over or up: to cover with ice: The windows in our house are icing up in the winter cold.Thesaurus: ice n. 1 frost | ice cube, iceberg, glacier. v. 1 to be icy, freeze, coat with ice 2 to frost (a cake).Usage Note: It is common for Americans to put ice in drinks. Most restaurants and bars automatically serve ice with water, soft drinks, and many cocktails unless the customer says, ""No ice.""",9
icy,"/asi/  adj. -ier, -iest 1 covered with ice: The roads are icy during a snowstorm. 2 cold and unfriendly: He has an icy personality.",9
ilk,"/lk/  n. [U] kind or type: Those men are nasty, and I don't associate with people of that ilk.",9
ill,"/l/  adj. 1 sick, unwell: He is ill; he has a bad cold. 2 to be ill at ease: to feel awkward or uncomfortable: She is often ill at ease with strangers. 3 to fall or be taken ill: to become sick  4 evil, terrible, used esp. as a prefix: A bomb exploded, and the ill-fated plane crashed.  adv. badly, unfavorably: He is a bad man, and others think ill of him.Thesaurus: ill adj. 1 not well, ailing, under the weather. Ant. well. adv. poorly.",1
I'm,/am/  contr. of I am: I'm a doctor.,9
imp,"/mp/  n. 1 a little devil: Some people think imps make us lie or steal. 2 fig. a naughty person, usu. young: That boy is an imp, always up to mischief. -adj. impish.",9
ink,"/k/  n. [U] a colored liquid used in pens: My teacher uses red ink to correct papers.  v. [T] to cover with ink: Long ago, printers had to ink their machines to print newspapers. -adj. inky.",9
inn,"/n/  n. a small hotel, usu. in the country, often serving meals: We like to stay at  small rural inns. See: bed and breakfast.Thesaurus: inn a lodge, bed and breakfast, B & B | motel.",9
IOU,"/aoyu/  n.abbr. of I owe you, a written promise to pay back money: I loaned my friend $100, and he gave me an IOU.Thesaurus: IOU a note, bill, promissory note.",9
IPA,/apiei/  See: International Phonetic Alphabet.,9
IRA,/aare/  abbr. for 1 Individual Retirement Account that permits one to save money for retirement without paying tax until the money is taken out  2 Irish Republican Army,1
irk,"/rk/  v. [T] to make angry (but not extremely angry), irritate, annoy: I was irked by the loud talk at the dining table next to mine. -adj. irksome.",9
IRS,"/ars/  abbr. for Internal Revenue Service, the USA's national tax collection agency: The IRS sent me a letter saying I had made a mistake on my tax form.",9
ism,"/zm/  n.infrml. a collection of knowledge and/or beliefs ending with the suffix ""-ism"": Socialism is one of the twentieth-century isms.",9
ISP,"/aspi/  n. & abbr. of Internet Service Provider, a company that sells connections to the Internet: America Online is a widely used ISP.",9
ivy,/avi/  n. [C;U] ivies a green plant with shiny leaves that can cover the ground or climb the walls of buildings: The walls of my cousin's brick house are green with ivy.,9
jab,"/db/  v. [I;T] jabbed, jabbing, jabs to hit with a quick, sharp blow: She jabbed me in the arm with her umbrella.  n. a quick, sharp blow: The boxer threw a jab at his opponent's face. See: poke.",9
jag,"/dg/  n.slang a period of doing s.t. without being able to stop, (syns.) a binge, spree: He's on a jag, buying everything that he likes in the store.",1
jar,"/dr/  n. 1 a round container made of glass, plastic, etc. with a removable top: a jar  of grape jelly (face cream, mustard, etc.) 2 a forceful hit, (syn.) a jolt v. jarred, jarring, jars 1 [I;T] to bump hard against s.t.: She moved her chair backwards, and it jarred against the wall. 2 [T] to shock: to jar s.o. back to reality 3 [I;T] to make s.o. angry, nervous, or impatient: Loud talk jars her nerves (or) on her nerves.Thesaurus: jar v. 1 to bang against, hit 2 to jolt 3 to grate on (s.o.).",9
jaw,"/d/  n. the lower and upper bones of the mouth, including the teeth: She couldn't eat because of her broken jaw.  v.infrml. [I] to gossip, chat: We jawed about the stock market all afternoon.",9
jay,"/de/  or jaybird /debrd/ n. a blue and gray bird common in North America: Jays have a loud, unpleasant cry.",9
jet,"/dt/  v. [I] jetted, jetting, jets 1 to fly by jet airplane 2 to come out of a small opening with great force: Water jets from the fountain.  n. 1 a jet-propelled airplane: He takes a jet from London to Paris. 2 a steady, controlled stream of gas, steam, liquid, etc. adj. (said of colors) completely, deep: jet black hair",9
Jew,/du/  n. 1 a member of the Jewish faith   2 a person of Jewish descent: The religion of the Jews is Judaism. -adj. Jewish.,9
jib,/db/  n. a triangular sail on a boat: The storm tore the boat's jib.,9
jig,"/dg/  n. 1 a quick, lively dance 2 in jig time: quickly, rapidly: He did that job in jig time!  v. [I] jigged, jigging, jigs to dance a jig",1
job,"/db/  n. 1 work that one is paid to do every day, permanent employment: She has a good job. 2 a specific task, piece of work: I have a job to do now, a long report. 3 slang to do a job on s.o.: to make others think badly of s.o., to criticize s.o.: The people at his former company really did a job on him by saying bad things about his past.  v. jobbed, jobbing, jobs: to job s.t. out: to have a job done outside of a business by another business, subcontract: Our company does not do any of its own printing; we job it out to local printers.Thesaurus: job n. 1 an occupation, career, position 2 a task, assignment, project.",9
jog,/dg/  v. [I] to run at a slow pace: He jogged around the park. 2 to jog s.o.'s memory: to cause s.o. to remember s.t.: I jogged his memory by reminding him of our meeting tomorrow.  n. a slow run: I go for a jog every evening.,9
jot,"/dt/  v. [T] jotted, jotting, jots to write short notes quickly: I jotted down her name and telephone number.",9
joy,"/d/  n. [U] 1 a moment of great happiness, delight: The parents felt joy at seeing their child begin to walk. 2 having a good time: We experienced the joy of having a wonderful vacation. 3 well-being over a long period, happiness: She knew the joy of being in good health and having no problems in life.Thesaurus: joy 1 happiness, pleasure, elation. Ant. sorrow.",9
jug,/dg/  n. a container for liquid with a handle: She put a jug of milk on the table.Thesaurus: jug a pitcher | bottle.,9
jut,"/dt/  v. [I] jutted, jutting, juts to stick out or rise sharply: Mountain peaks jut into the sky.",9
keg,/kg/  n. a small barrel made of metal or wood: He bought a keg of beer for the victory party.,1
key,"/ki/  n. 1 a thin piece of metal used to lock or unlock a door, start or stop an engine, etc.: I opened the front door with my key. 2 fig. the most important part of s.t.: The key to success is hard work. 3 a written guide that explains the meaning of s.t.: This key explains how to read the symbols on the map. 4 in music, a group of notes related to and named after the lowest note in the group: That song is written in the key of B flat. 5 a part of a machine or musical instrument that is pressed down to make it work: She pressed a computer key and typed a letter. 6 a small low island: We went camping in the Florida Keys last summer.  v. 1 [T] to test musical instruments to make sure that they will sound good together: Musicians in the band keyed their guitars before playing. 2 to be keyed up: to be excited or nervous: She is always keyed up before a test.  adj. very important, essential: Cotton is a key industry in the South.",9
kin,/kn/  n.pl. relative: My mother is my next of kin; my father's dead.,9
kit,"/kt/  n. 1 a group of tools, supplies, etc. kept together, often in a box, and used for a certain purpose: a mechanic's kit, a carpenter's kit, a make-up kit 2 a group of parts or materials to be put together to make s.t.: We sell model airplane (car, train, etc.) kits.",9
KKK,  abbr.for Ku Klux Klan,9
lab,/lb/  n. See: laboratory.,9
lad,/ld/  n.infrml.old usage a boy or young man: He was just a lad when he went to sea as a cabin boy.,9
lag,"/lg/  n. a delay, slowness: There was a lag in communications, so he did not hear the news until many days later.  v. [I] lagged, lagging, lags to not keep up, to delay, (syn.) to straggle: The little boy lagged behind the others on the walk.",1
lam,"/lm/  n.slang to be on the lam: to run away, escape: When the police caught the robber, he had been on the lam for three weeks.",9
lap,"/lp/  v. lapped, lapping, laps 1 [T] to lick with the tongue as in taking up liquid: A cat laps milk from a bowl. 2 [I;T] (in racing) to go ahead of a competitor by a complete circuit: The leader lapped the others. 3 [I] (of water) to hit against s.t. with small movements and soft sounds: The waves lapped against the side of the ship. 4 phrasal v. sep.infrml. [T] to lap s.t. up: to receive eagerly, (syn.) to relish: She lapped up all his flattery.||She lapped it up.  n. 1 the area formed by the top of the legs in a seated position: The baby sat on his mother's lap. 2 a circuit around a track or a length of a swimming pool: The runner (or swimmer) did 20 laps for practice. 3 in the lap of luxury: to be in a position of great wealth: We stayed in the lap of luxury in our expensive deluxe hotel.",9
law,"/l/  n. 1 [C] a rule made by a government body that must be followed by the people in a nation, state, etc.: In the USA, laws are written by Congress and by state legislatures. 2 [U] such rules as a group: Lawyers must know the law. 3 [U] the officials and courts of the legal system: The man is in jail, because he got into trouble with the law. 4 [C] (in many religions) a commandment from God 5 [C] a statement describing what happens under certain conditions: the law of gravity 6 to lay down the law: to demand obedience to one's rules: He laid down the law to his children that they had to be home by 11:00 P.M. 7 to take the law into one's own hands: to take for oneself the power of a legal authority: Instead of waiting for the police, an angry group took the law into their own hands by catching and beating the thief.  adj. related to law: She has a law degree.",9
lax,"/lks/  adj. 1 lacking in strict attention to details: His bookkeeping is lax. 2 careless, lacking control, (syn.) negligent: Enforcement of some laws in this city is lax. -n. [U] laxity.",9
leg,"/lg/  n. 1 one of the lower limbs of humans and many animals, used for walking, running, etc.: Runners need strong legs. 2 one of the supports of a piece of furniture: Don't sit on that chair; one of the legs is broken. 3 a part of a journey: She flew first to Rome, then to Pisa, then made the last leg of her trip by taxi. 4 infrml. Break a leg!: an expression meaning ""good luck!"" used mostly in a theater setting  5 infrml. not to have a leg to stand on: to have no basis for a claim, demand, etc.: The law is entirely against him; he doesn't have a leg to stand on. 6 infrml. to be on one's last legs: to be worn out, close to failure or death: This old car is on its last legs. 7 infrml. to cost an arm and a leg: to cost much more than expected: The lawsuit cost her an arm and a leg, but she won. 8 infrml. to give s.o. a leg up or to have a leg up (on s.t.): to put s.o. or be in a good position (in a competition): He has a leg up on getting that job, because he has a friend in the personnel section who recommended him. 9 infrml. to pull s.o.'s leg: to play a trick on s.o., to tease s.o.: She was pulling my leg when she said she had won $1 million in the lottery. 10 infrml. to shake a leg: a. to hurry, move fast: His boss told him to shake a leg and deliver the package. b. to dance: Tonight, we're going to shake a leg. 11 to stretch one's legs: to take a walk, esp. after sitting or staying indoors a long time: I'm going outside to stretch my legs.",9
let,"/lt/  v. let, letting, lets 1 [T] to allow, permit: I let my dog run free in the yard. 2 [T] to rent, lease: The landlord lets apartments to tenants. 3 let alone: even less: I can't afford a nice apartment, let alone a house! 4 to let go: a. to set free, release: Because they had no evidence, the police had to let the suspect go. b. infrml. to release emotions, act freely: She let go and danced wildly to the music. 5 to let go of: to release one's hold on: A monkey let go of a branch and dropped to the ground. 6 slang to let it all hang out: to act without reserve, show all that is on one's mind: My friend was deeply troubled, and she finally let it all hang out. 7 slang to let it rip: to allow s.t. (forceful, dangerous, loud, etc.) to happen: We wanted loud music to dance to, so I told the band leader to let it rip. 8 infrml. to let off steam: to release one's frustrations: She had a hard day at the office and let off steam at home by talking about it. 9 phrasal v. [I] to let on: to tell that one knows s.t. secret: She learned about the surprise party planned for her but didn't let on that she knew. 10 to let oneself go: to stop taking care of one's appearance: Since he lost his job, he has stopped shaving and has generally let himself go. 11 phrasal v. [T] to let out: a. to allow to go out: I let the cat out at night. b. to allow (a sound) to come out, express: I let out a yell when I hurt my finger. c. (in sewing) to make larger: The waist in these pants needs to be let out. See: take, 32b. 12 to let s.o. in on: a. to allow s.o. to participate: We let a friend in on a good business deal. b. to tell s.o. a secret: I let others in on the fact that the factory is closing down soon. 13 to let s.o. know: to tell or inform s.o.: Please let me know if you'll be late. 14 to let s.o. off: to release with little or no punishment: The judge let the young man off with a short prison sentence. 15 to let s.o. or s.t. down:  a. to disappoint, fail to meet the expectations of: When they lost, the players felt they had let their coach down. b. (in sewing) to make longer: These pants need to be let down an inch. See: take, 56a. 16 to let s.o. or s.t. go by:  a. to allow to pass: I stepped aside and let others go by me. b. to pay no attention to, (syn.) to ignore: I just let his stupid insult go by. 17 to let s.o. or s.t. in: to allow to enter: She opened a window to let some fresh air in. 18 phrasal v. infrml. [I] to let up: to become less intense or forceful: The rain is letting up now.  n. (in tennis or volleyball) a serve that touches the net and is invalid",9
lib,/lb/  n. short for liberation.,1
lid,"/ld/  n. 1 a covering of a container, a top: I took the lid off the coffee can and scooped some coffee out. 2 short for eyelid, the skin over the eye: The baby closed her lids and went to sleep. 3 infrml. to blow the lid off: to suddenly expose (s.t. that was secret): The story in the newspaper blew the lid off the company's plan to buy the land. 4 infrml. to keep the lid on: to prevent (rioting, trouble, scandal, etc.): The police patrolled the city to keep the lid on any rioting or looting.",9
lip,"/lp/  n. 1 one of two fleshy borders of the human mouth: She put red lipstick on her lips. 2 the top edge of s.t.: There is gold trim around the lip of the teacup. 3 suffix -lipped: having lips as described: She was white-lipped with fear. 4 infrml. to give s.o. lip: to speak to s.o. without respect, (syn.) to sass: The supervisor criticized the worker, who then gave the supervisor a lot of lip. 5 to keep a stiff upper lip: to hold in one's feelings during a difficult time: Through all his bad luck, he kept a stiff upper lip. 6 to smack one's lips:  a. to press together and open one's lips noisily: He smacked his lips when he saw the delicious food. b. fig. to express delight: He smacked his lips over the big profit he would make.Thesaurus: lip 2 a rim (of a container, opening), projecting edge, brim | spout.",9
lob,"/lb/  v. [T] lobbed, lobbing, lobs n. to hit or throw (a ball) high and gently: The father <v.> lobbed the ball to the child.",9
log,"/lg, lg/  n. 1 a tree trunk or large branch that has either fallen or been cut: The man cut trees into logs with a chain saw. 2 a journal or other record of information: He keeps a computerized log of all shipments that enter and leave the warehouse. 3 infrml. a bump on a log: a stupid, lazy person: He just sat in class like a bump on a log and never passed the course.  v. logged, logging, logs 1 [I;T] to cut trees into logs: He works as a lumberjack, logging trees for a big paper company. 2 [T] to enter into a written record: The sergeant logs (in) the name of each soldier as he arrives at camp. 3 [T] to earn credit for time spent working, distance traveled, etc.: During her training, the pilot logged 100 hours on planes of this type. 4 phrasal v. insep. [I] to log on to s.t.: to enter into a computer system, usu. with a password: I logged on to an information service by using my modem.Thesaurus: log n. 1 timber, lumber 2 a register, official record (flight, voyage). v. 1 to timber 2 to register, record  3 to spend, record.",9
lop,"/lp/  v. [T] lopped, lopping, lops to cut, chop: A farm worker lopped the green tops off carrots with a knife.",9
lot,"/lt/  n. 1 [C] a piece of land: We own a small lot next to our house. 2 [U] one's condition in life, fate: It was his lot to become priest. 3 infrml. a lot (of) or lots (of): a large amount or number: I like her a lot.||He has lots of money, problems, etc. 4 to draw lots: to use chance to make a choice, such as by picking straws of differing lengths: We drew lots to decide who would go first, second, and third.Thesaurus: lot 1 a plot, parcel (land) 2 destiny, fortune.",9
low,"/lo/  adj. -er, -est 1 below s.t. else in level: The land is low in this area; it is near sea level.||I was glad to pay such a low price for the car. 2 near the floor or ground: There was a low table in front of the sofa. 3 (of a sound) quiet or deep: They spoke in low voices so as not to disturb anyone.||The radio announcer had a low voice. 4 fig. morally bad, dishonest: He stole from his friend, and that was a low thing to do. 5 fig. sad, depressed: She is feeling low about the death of her father. 6 to be low on s.t.: to have only a little of s.t. left: We were low on gas, so we drove into a gas station to buy some.  adv. 1 in, at, or to a negligible position or level: She scored low on the test. 2 near the floor or ground: He bent low to pick up the child.  n. 1 a depth: Winter temperatures there reach extreme lows. 2 to hit a new low: to reach the lowest point so far: The price of that stock hit a new low yesterday.  v. to make a sound like a cow, to moo: The cows are lowing in the field.",1
lox,/lks/  n. [U] smoked salmon: Many people enjoy lox and cream cheese on bagels.,9
LPN,/lpin/  n. See: licensed practical nurse.,9
LSD,"/lsdi/  n. [U] abbr. for lysergic acid diethylamide, a powerful drug that makes people see things in strange ways: In the 1960s, many young people experimented with LSD.",9
lug,"/lg/  v.infrml. [T] lugged, lugging, lugs to carry or pull with difficulty, haul: I lugged two heavy suitcases to the train station.  n. 1 short for lug nut, a small piece of metal used as a fastener: The mechanic used a lug wrench to loosen the lugs and remove the tire. 2 slang a big, fool: He is a friendly lug.",9
lye,/la/  n. [U] a strong alkaline liquid: Lye has a very strong cleaning action.,9
mad,"/md/  adj. madder, maddest 1 angry, upset: She was mad when her boyfriend was late without calling her. 2 strongly attracted to s.t. or s.o.: He is mad about fast cars. 3 crazy: He went mad when his wife died.Thesaurus: mad 1 furious, irate | annoyed, irritated. Ant. pleased. 2 crazy about, wild about | in love with. Ant. uninterested. 3 insane, mentally ill. Ant. sane.",9
map,"/mp/  n. a graphic representation or plan of geographic locations: We looked at a map to find the best roads from Boston to Chicago.  v. [T] mapped, mapping, maps 1 to make a map of s.t.: Engineers mapped the area for a road. 2 phrasal v. sep. to map s.t. out: to plan in detail: They mapped out exactly what to study for the examination.||They mapped it out.Thesaurus: map n. a chart | layout.",1
mar,"/mr/  v. [T] marred, marring, mars to damage; to make a cut, bruise, or dent in s.t., (syn.) to deface: A scratch in the side of the car marred its appearance.",9
mat,"/mt/  n. a piece of material often of rectangular shape with many uses, such as under plates on tables, in front of doors, on floors, etc.: We wipe our feet on the mat in front of our door to remove dirt from our shoes.  v. [I;T] matted, matting, mats to tangle, press down: The rain matted the dog's hair.",9
men,"/mn/  n.pl.  of man: human males in general: Men wear suits to work.Thesaurus: men gentlemen, fellows | guys infrml.",9
met,/mt/  v. past tense & past part. of meet: We met in the park last week.,9
mew,/myu/  n.v. [I] var. of meow: The kitten <v.> mews when it is hungry.,9
mgr,"/mndr/  n.abbr. for manager: She signs her letters, Jane Wong, General Mgr.",9
